{
  "schema_version": "0.7",
  "run_id": "run-1",
  "provenance": {
    "aqef_version": "0.41.5",
    "cts_revision": "WD10",
    "cts_commit": "<commit of the CTS used>",
    "harness_contract_version": "0.7",
    "harness_version": "0.5.0",
    "adapter_id": "example-rest-adapter",
    "adapter_version": "0.4.0",
    "sut_name": "Example Engine (mock)",
    "sut_version": "1.2",
    "conformance_statement_ref": "evidence://statement-example-engine-1.2.json",
    "capabilities_claimed": [
      "cli"
    ],
    "drain_ms": 5000
  },
  "plan": {
    "scope": "partial",
    "test_ids": [
      "CT-CFG-025",
      "CT-ASM-001",
      "CT-SDK-001",
      "CT-SDK-002",
      "CT-REL-023"
    ],
    "reason": "Example: five tests chosen to show the aggregation rules."
  },
  "started_at": "2026-10-20T18:00:00Z",
  "ended_at": "2026-10-20T19:10:00Z",
  "summary": {
    "cases": {
      "FAIL": 1,
      "NOT_RUN": 1,
      "PASS": 24,
      "NOT_APPLICABLE": 3
    },
    "tests": {
      "FAIL": 1,
      "NOT_RUN": 1,
      "PASS": 2,
      "NOT_APPLICABLE": 1
    },
    "requirements": {
      "verified": 23,
      "violated": 4,
      "unverified": 386,
      "not_applicable": 4
    }
  },
  "cases": [
    {
      "case_id": "CT-CFG-025.01",
      "test_id": "CT-CFG-025",
      "capability": "core",
      "outcome": "PASS",
      "reason_code": "EXPECTED_MET",
      "evidence_refs": [
        "evidence://CT-CFG-025.01.json"
      ],
      "evidence_grades": [
        "observed"
      ],
      "setup_status": "ready",
      "cleanup_status": "complete"
    },
    {
      "case_id": "CT-CFG-025.02",
      "test_id": "CT-CFG-025",
      "capability": "core",
      "outcome": "PASS",
      "reason_code": "EXPECTED_MET",
      "evidence_refs": [
        "evidence://CT-CFG-025.02.json"
      ],
      "evidence_grades": [
        "observed"
      ],
      "setup_status": "ready",
      "cleanup_status": "complete"
    },
    {
      "case_id": "CT-CFG-025.03",
      "test_id": "CT-CFG-025",
      "capability": "core",
      "outcome": "PASS",
      "reason_code": "EXPECTED_MET",
      "evidence_refs": [
        "evidence://CT-CFG-025.03.json"
      ],
      "evidence_grades": [
        "observed"
      ],
      "setup_status": "ready",
      "cleanup_status": "complete"
    },
    {
      "case_id": "CT-CFG-025.04",
      "test_id": "CT-CFG-025",
      "capability": "core",
      "outcome": "PASS",
      "reason_code": "EXPECTED_MET",
      "evidence_refs": [
        "evidence://CT-CFG-025.04.json"
      ],
      "evidence_grades": [
        "observed"
      ],
      "setup_status": "ready",
      "cleanup_status": "complete"
    },
    {
      "case_id": "CT-CFG-025.05",
      "test_id": "CT-CFG-025",
      "capability": "core",
      "outcome": "PASS",
      "reason_code": "EXPECTED_MET",
      "evidence_refs": [
        "evidence://CT-CFG-025.05.json"
      ],
      "evidence_grades": [
        "observed"
      ],
      "setup_status": "ready",
      "cleanup_status": "complete"
    },
    {
      "case_id": "CT-CFG-025.06",
      "test_id": "CT-CFG-025",
      "capability": "core",
      "outcome": "PASS",
      "reason_code": "EXPECTED_MET",
      "evidence_refs": [
        "evidence://CT-CFG-025.06.json"
      ],
      "evidence_grades": [
        "observed"
      ],
      "setup_status": "ready",
      "cleanup_status": "complete"
    },
    {
      "case_id": "CT-CFG-025.07",
      "test_id": "CT-CFG-025",
      "capability": "core",
      "outcome": "PASS",
      "reason_code": "EXPECTED_MET",
      "evidence_refs": [
        "evidence://CT-CFG-025.07.json"
      ],
      "evidence_grades": [
        "observed"
      ],
      "setup_status": "ready",
      "cleanup_status": "complete"
    },
    {
      "case_id": "CT-CFG-025.08",
      "test_id": "CT-CFG-025",
      "capability": "core",
      "outcome": "PASS",
      "reason_code": "EXPECTED_MET",
      "evidence_refs": [
        "evidence://CT-CFG-025.08.json"
      ],
      "evidence_grades": [
        "observed"
      ],
      "setup_status": "ready",
      "cleanup_status": "complete"
    },
    {
      "case_id": "CT-CFG-025.09",
      "test_id": "CT-CFG-025",
      "capability": "core",
      "outcome": "PASS",
      "reason_code": "EXPECTED_MET",
      "evidence_refs": [
        "evidence://CT-CFG-025.09.json"
      ],
      "evidence_grades": [
        "observed"
      ],
      "setup_status": "ready",
      "cleanup_status": "complete"
    },
    {
      "case_id": "CT-CFG-025.10",
      "test_id": "CT-CFG-025",
      "capability": "core",
      "outcome": "PASS",
      "reason_code": "EXPECTED_MET",
      "evidence_refs": [
        "evidence://CT-CFG-025.10.json"
      ],
      "evidence_grades": [
        "observed"
      ],
      "setup_status": "ready",
      "cleanup_status": "complete"
    },
    {
      "case_id": "CT-CFG-025.11",
      "test_id": "CT-CFG-025",
      "capability": "core",
      "outcome": "PASS",
      "reason_code": "EXPECTED_MET",
      "evidence_refs": [
        "evidence://CT-CFG-025.11.json"
      ],
      "evidence_grades": [
        "observed"
      ],
      "setup_status": "ready",
      "cleanup_status": "complete"
    },
    {
      "case_id": "CT-CFG-025.12",
      "test_id": "CT-CFG-025",
      "capability": "core",
      "outcome": "PASS",
      "reason_code": "EXPECTED_MET",
      "evidence_refs": [
        "evidence://CT-CFG-025.12.json"
      ],
      "evidence_grades": [
        "observed"
      ],
      "setup_status": "ready",
      "cleanup_status": "complete"
    },
    {
      "case_id": "CT-CFG-025.13",
      "test_id": "CT-CFG-025",
      "capability": "core",
      "outcome": "PASS",
      "reason_code": "EXPECTED_MET",
      "evidence_refs": [
        "evidence://CT-CFG-025.13.json"
      ],
      "evidence_grades": [
        "observed"
      ],
      "setup_status": "ready",
      "cleanup_status": "complete"
    },
    {
      "case_id": "CT-CFG-025.14",
      "test_id": "CT-CFG-025",
      "capability": "core",
      "outcome": "PASS",
      "reason_code": "EXPECTED_MET",
      "evidence_refs": [
        "evidence://CT-CFG-025.14.json"
      ],
      "evidence_grades": [
        "observed"
      ],
      "setup_status": "ready",
      "cleanup_status": "complete"
    },
    {
      "case_id": "CT-CFG-025.15",
      "test_id": "CT-CFG-025",
      "capability": "core",
      "outcome": "PASS",
      "reason_code": "EXPECTED_MET",
      "evidence_refs": [
        "evidence://CT-CFG-025.15.json"
      ],
      "evidence_grades": [
        "observed"
      ],
      "setup_status": "ready",
      "cleanup_status": "complete"
    },
    {
      "case_id": "CT-CFG-025.16",
      "test_id": "CT-CFG-025",
      "capability": "core",
      "outcome": "PASS",
      "reason_code": "EXPECTED_MET",
      "evidence_refs": [
        "evidence://CT-CFG-025.16.json"
      ],
      "evidence_grades": [
        "observed"
      ],
      "setup_status": "ready",
      "cleanup_status": "complete"
    },
    {
      "case_id": "CT-CFG-025.17",
      "test_id": "CT-CFG-025",
      "capability": "core",
      "outcome": "PASS",
      "reason_code": "EXPECTED_MET",
      "evidence_refs": [
        "evidence://CT-CFG-025.17.json"
      ],
      "evidence_grades": [
        "observed"
      ],
      "setup_status": "ready",
      "cleanup_status": "complete"
    },
    {
      "case_id": "CT-CFG-025.18",
      "test_id": "CT-CFG-025",
      "capability": "core",
      "outcome": "NOT_RUN",
      "reason_code": "SETUP_FAILED",
      "reason": "Starting configuration F-RETRY was rejected by the SUT.",
      "evidence_refs": [
        "evidence://CT-CFG-025.18.setup.json"
      ],
      "evidence_grades": [
        "observed"
      ],
      "setup_status": "failed",
      "cleanup_status": "complete"
    },
    {
      "case_id": "CT-CFG-025.19",
      "test_id": "CT-CFG-025",
      "capability": "core",
      "outcome": "PASS",
      "reason_code": "EXPECTED_MET",
      "evidence_refs": [
        "evidence://CT-CFG-025.19.json"
      ],
      "evidence_grades": [
        "observed"
      ],
      "setup_status": "ready",
      "cleanup_status": "complete"
    },
    {
      "case_id": "CT-CFG-025.20",
      "test_id": "CT-CFG-025",
      "capability": "core",
      "outcome": "PASS",
      "reason_code": "EXPECTED_MET",
      "evidence_refs": [
        "evidence://CT-CFG-025.20.json"
      ],
      "evidence_grades": [
        "observed"
      ],
      "setup_status": "ready",
      "cleanup_status": "complete"
    },
    {
      "case_id": "CT-CFG-025.21",
      "test_id": "CT-CFG-025",
      "capability": "core",
      "outcome": "PASS",
      "reason_code": "EXPECTED_MET",
      "evidence_refs": [
        "evidence://CT-CFG-025.21.json"
      ],
      "evidence_grades": [
        "observed"
      ],
      "setup_status": "ready",
      "cleanup_status": "complete"
    },
    {
      "case_id": "CT-CFG-025.22",
      "test_id": "CT-CFG-025",
      "capability": "core",
      "outcome": "PASS",
      "reason_code": "EXPECTED_MET",
      "evidence_refs": [
        "evidence://CT-CFG-025.22.json"
      ],
      "evidence_grades": [
        "observed"
      ],
      "setup_status": "ready",
      "cleanup_status": "complete"
    },
    {
      "case_id": "CT-CFG-025.23",
      "test_id": "CT-CFG-025",
      "capability": "core",
      "outcome": "PASS",
      "reason_code": "EXPECTED_MET",
      "evidence_refs": [
        "evidence://CT-CFG-025.23.json"
      ],
      "evidence_grades": [
        "observed"
      ],
      "setup_status": "ready",
      "cleanup_status": "complete"
    },
    {
      "case_id": "CT-CFG-025.24",
      "test_id": "CT-CFG-025",
      "capability": "dataset_mechanism:edge_cases",
      "outcome": "NOT_APPLICABLE",
      "reason_code": "CAPABILITY_NOT_CLAIMED",
      "reason": "dataset_mechanism:edge_cases is not claimed in the Conformance Statement.",
      "evidence_refs": [],